id,region_id,name,description,image_url
37,12,最後の晩餐,レオナルド・ダ・ヴィンチがサンタ・マリア・デッレ・グラツィエ教会に描いた壁画の傑作。 イエス・キリストが弟子たちと食卓を囲む、劇的な瞬間を見事に捉えています。 保存状態の維持のため、鑑賞は完全予約制で人数制限があるため、非常に貴重。 限られた時間の中で、この大作が放つ迫力と構成の妙をじっくりと堪能できます。 ルネサンスの巨匠が残した、人類の芸術的遺産をその目で見るチャンス。 世界で最も有名な絵画の一つとの、貴重な対面を果たしましょう。,/images/tourist_spot/037.jpg
38,12,ガッレリア,鉄骨とガラスのドームが美しい、ヨーロッパ最古のショッピングアーケード。 プラダやルイ・ヴィトンなど、高級ブランド店や歴史あるカフェが並びます。 優雅な空間は「ミラノの応接間」とも呼ばれ、街の人々の憩いの場でもあります。 床に描かれた牡牛のモザイクの上で一回転すると幸運が訪れるという伝説も。 ミラノのファッションと文化、そして歴史を感じられる華やかな場所。 優雅な空間でショッピングやカフェを楽しみ、ミラノのエッセンスを味わいましょう。,/images/tourist_spot/038.jpg
39,13,ポンペイ遺跡,紀元79年のベスビオ火山噴火により一瞬で埋没した、古代都市の遺跡。 当時の街並み、住居、公共浴場などがほぼ完璧な形で保存されています。 壁画やモザイク画が残る富裕層の家や、生々しい石膏像が生前の生活を伝えます。 2000年前のローマ人の暮らしぶりを、まるで昨日のできごとのように感じられます。 古代ローマの歴史にタイムスリップできる、世界的に貴重な考古学の現場。 歴史の重みと、自然の力の恐ろしさを体感できる場所です。,/images/tourist_spot/039.jpg
40,13,ベスビオ火山,ポンペイなど古代都市を飲み込んだ、今も活動を続けるイタリア本土唯一の活火山。 山頂の火口付近まで登ることができ、地球のエネルギーを感じられます。 山頂からの眺めは、ナポリ湾と遠くの街並みを見渡す絶景です。 豊かな土壌から生まれるワインなど、火山の恵みを感じることもできます。 大地の力強さと、自然の脅威を肌で感じられる貴重な体験。 イタリアの歴史と自然を語る上で欠かせない、象徴的な存在です。,/images/tourist_spot/040.jpg
41,13,サン・セヴェーロ礼拝堂,世界一美しい大理石彫刻と称される『ヴェールを被ったキリスト』が展示される礼拝堂。 布の透け感まで表現された、驚異的な写実性と技術を持つ彫刻に圧倒されます。 ナポリの貴族の遺言で、細部にまでこだわって作られた秘密めいた空間。 礼拝堂全体が、芸術と謎めいた哲学に満ちた特別な雰囲気を持っています。 写真撮影禁止のため、その感動は訪れた人だけの特権となります。 ナポリの隠れた至宝、息をのむような芸術体験を求めるならぜひ。,/images/tourist_spot/041.jpg
42,13,国立考古学博物館,ポンペイやヘルクラネウムなどの遺跡から発掘された、古代ローマの至宝を収蔵。 フレスコ画、モザイク画、彫刻など、貴重な美術品が豊富に展示されています。 特に、ポンペイの日常を伝える展示品の数々は非常に興味深いもの。 古代ギリシャ・ローマ美術の最高傑作を鑑賞できる、世界的に重要な博物館です。 この場所を訪れれば、ポンペイ遺跡をより深く理解することができます。 地中海文明の歴史と芸術が凝縮された、知的好奇心を刺激する場所です。,/images/tourist_spot/042.jpg
43,14,青の洞窟,太陽光が洞窟の奥から差し込み、水面が神秘的な青い光を放つ絶景の洞窟。 小舟に乗って狭い入り口をくぐり抜ける瞬間は、まるで別世界への入り口のようです。 船頭さんの歌声が響く中、水面が輝く様子は、言葉にできない美しさ。 天候や波の状況によって入洞できないため、限られた幸運な人だけが出会える光景。 カプリ島の自然が作り出した、幻想的な光のショーを体験しませんか。 世界中を魅了する、神秘的な青の輝きをその目で確かめてください。,/images/tourist_spot/043.jpg
44,14,モンテ・ソラーロ,カプリ島で最も高い山で、島全体とナポリ湾を一望できる最高の展望台。 一人乗り用のリフト（セッジョーヴィア）に乗って、空を飛ぶような優雅な山頂へ。 山頂からは、カプリ島、ナポリ湾、ベスビオ火山までのパノラマビューが楽しめます。 島の美しい自然と、地中海の青さを心ゆくまで満喫できる場所です。 喧騒を離れ、静寂の中で壮大な景色を楽しむ至福のひととき。 カプリ島の美しさを上空から体験したいなら、ぜひ訪れるべき場所です。,/images/tourist_spot/044.jpg
45,14,アウグスト庭園,カプリ島の中心部にある、美しい花々が咲き誇る絶景の庭園。 庭園からは、海に突き出た有名な奇岩「ファラリオーニ」の絶景が見渡せます。 崖に沿って曲がりくねる「ヴィア・クルップ」の道もここから一望できます。 庭園の散策路からは、青い海と空、そして岩のコントラストが美しい景色が楽しめます。 手入れの行き届いた庭園で、地中海のリゾート気分を味わいましょう。 カプリ島の自然美と、手入れされた景観が調和したロマンチックな場所です。,/images/tourist_spot/045.jpg
46,15,ポジターノ,崖にへばりつくようにカラフルな家々が建ち並ぶ、アマルフィ海岸屈指の景勝地。 息をのむような美しい景観は、多くの映画や写真の舞台となっています。 迷路のような細い路地を散策し、ブティックやカフェを巡るのが楽しい場所。 地中海の青い海と、斜面に連なる街並みのコントラストは感動的。 イタリアの「美しい村」の代表格で、優雅なリゾート気分を満喫できます。 夢のように美しい街で、地中海の輝きに包まれる特別な時間をどうぞ。,/images/tourist_spot/046.jpg
47,15,アマルフィ大聖堂,アマルフィ共和国の栄華を象徴する、華麗なロマネスク様式の大聖堂。 鮮やかな黄土色のファサードと、エキゾチックなモザイクの装飾が目を引きます。 聖アンドレアの遺骸が安置されている場所としても知られています。 長くて急な階段を上って訪れるその姿は、街のシンボルとして圧倒的な存在感。 かつて海洋都市国家として栄えたアマルフィの歴史を感じられる場所です。 アマルフィ海岸の美しい景色と共に、歴史的な建築美を堪能しましょう。,/images/tourist_spot/047.jpg
48,15,ラヴェッロ,アマルフィ海岸を見下ろす高台に位置する、静かで美しい天空の村。 喧騒を離れた落ち着いた雰囲気と、息をのむような絶景が魅力です。 特に、ヴィラ・ルーフォロやヴィラ・チンブローネからの眺めは天下一品。 ワーグナーなど多くの芸術家に愛された、ロマンチックな場所としても有名です。 テラスから見下ろす紺碧の地中海は、まるで絵画のような美しさ。 アマルフィ海岸の優雅なリゾート気分を、静かに堪能したい方におすすめです。,/images/tourist_spot/048.jpg
49,16,エトナ山,ヨーロッパ最大の活火山であり、今もなお活動を続ける自然の驚異。 標高が高く、年間を通じて雪を抱く姿は、南国のシチリアで異彩を放ちます。 ツアーに参加して火口付近まで登れば、地球の息吹を間近に感じられます。 火山活動によって形成された独特の景観や、肥沃な土地が育むブドウ畑も魅力。 その壮大さと、時折噴煙を上げる姿は、訪れる者に畏敬の念を抱かせます。 シチリアの大自然の力を体感できる、忘れられない体験を。,/images/tourist_spot/049.jpg
50,16,タオルミーナのギリシャ劇場,イオニア海を見下ろす高台に位置する、古代ギリシャ・ローマ時代の劇場跡。 劇場の石段の向こうには、青い海とエトナ山の雄大な姿が広がる絶景。 世界で最も美しい景色を持つ劇場として、今もなお人々を魅了し続けています。 夏にはコンサートやオペラが開催され、歴史的な舞台で現代の芸術に触れられます。 古代の歴史とシチリアの自然美が融合した、感動的な場所。 この絶景の劇場で、古代人の感性と自然の雄大さに思いを馳せましょう。,/images/tourist_spot/050.jpg
51,16,パレルモ大聖堂,シチリアの歴史を物語る、様々な様式が混在する壮麗な大聖堂。 イスラム、ノルマン、ゴシック、バロックなど、複数の文化の影響が見られます。 金のモザイクが美しい内部や、屋上からのパレルモ市街の眺めも魅力。 シチリア島の支配者が変わるたびに改築された、複雑な歴史の証人です。 多様な文化が交差したシチリアの歴史を、建築を通して感じられます。 パレルモの街の中心で、異文化が融合した独自の美しさを発見してください。,/images/tourist_spot/051.jpg
52,16,神殿の谷（アグリジェント）,地中海を見下ろす丘の上に、古代ギリシャの神殿が立ち並ぶ壮大な遺跡群。 ドーリア式神殿の壮麗な姿が、当時のマグナ・グラエキアの繁栄を伝えます。 特にコンコルディア神殿は保存状態が良く、美しい姿を今に伝えています。 夕暮れ時、黄金色に染まる神殿の姿は、まるで神話の世界のような幻想的な光景。 地中海文明の歴史と、シチリアの雄大な自然を同時に感じられます。 古代ギリシャの栄光が残るこの場所で、歴史のロマンに浸りましょう。,/images/tourist_spot/052.jpg
53,17,5つの村,険しい海岸線にカラフルな家々がへばりつくように建つ、世界遺産の絶景。 モンテロッソ、ヴェルナッツァ、コルニーリア、マナローラ、リオマッジョーレの五つの村。 村々を結ぶハイキングコースからの眺めは、息をのむほどの美しさです。 素朴で静かな村々の生活と、地中海の自然が織りなす癒しの空間。 車が入れないため、ハイキングや鉄道、船で巡る特別な旅が楽しめます。 イタリアで最も美しい海岸線の風景を、五感をフルに使って満喫してください。,/images/tourist_spot/053.jpg
54,17,愛の小道,チンクエテッレのリオマッジョーレとマナローラを結ぶ、海沿いの遊歩道。 名前の通りロマンチックな雰囲気で、恋人たちが愛を語り合った場所として知られます。 道の途中には愛の南京錠が掛けられたフェンスなどがあり、写真スポットになっています。 海沿いの断崖絶壁を歩くコースからの眺めは、絶景の一言。 残念ながら現在は閉鎖区間がありますが、再開が待たれるロマンの道です。 地中海の青い海と空の下、愛の物語を感じながら散策を楽しみましょう。,/images/tourist_spot/054.jpg
55,18,エッフェル塔,パリの象徴であり、世界のランドマークとして愛され続ける鉄骨の塔。 展望台からは、パリの美しい街並みとセーヌ川のパノラマを一望できます。 夜にはライトアップされ、毎正時のシャンパンフラッシュは感動的な美しさ。 エレガントな鉄骨の構造は、建設当初の批判を乗り越え、今や芸術品となりました。 昼間だけでなく、夜のロマンチックな姿も必見です。 パリで最も高い場所から、愛の都の輝きを心ゆくまで眺めましょう。,/images/tourist_spot/055.jpg
56,18,ルーヴル美術館,世界最大級の美術館であり、人類の芸術的遺産が詰まった宝庫。 レオナルド・ダ・ヴィンチの『モナ・リザ』や『ミロのヴィーナス』など、名作がずらり。 かつては王宮だった建物自体が芸術品であり、その広大さに圧倒されます。 ガラスのピラミッドから入る瞬間から、芸術の旅が始まります。 一日では回りきれないほどの至宝の数々に、感性を刺激されること間違いなし。 芸術の都パリが誇る、世界最高の美の殿堂へ。,/images/tourist_spot/056.jpg
57,18,凱旋門,ナポレオンがフランス軍の勝利を記念して建設させた、パリを象徴する巨大な門。 シャンゼリゼ通りの起点に堂々とそびえ立ち、その迫力に圧倒されます。 屋上展望台からは、放射状に広がるパリの街路を一望できます。 特に、シャンゼリゼ通りを見下ろす景観は格別で、パリの華やかさを感じられます。 夜にはライトアップされ、その威厳ある姿はより一層荘厳な雰囲気に。 パリの歴史と栄光を感じられる、シャンゼリゼのシンボルを訪れましょう。,/images/tourist_spot/057.jpg
58,18,ノートルダム大聖堂,セーヌ川のシテ島に建つ、フランス・ゴシック建築の最高傑作の一つ。 荘厳なファサードと、精巧なステンドグラスが、訪れる者を圧倒します。 火災からの復興作業が進められており、その姿はフランスの精神的な象徴です。 ヴィクトル・ユーゴーの小説の舞台としても有名で、歴史と文学のロマンを感じさせます。 再建後の美しい姿を待ち望みながら、その歴史的な重みに思いを馳せて。 パリの心臓部で、中世からの歴史を見つめる大聖堂の姿に感動しましょう。,/images/tourist_spot/058.jpg
59,18,シャンゼリゼ通り,凱旋門とコンコルド広場を結ぶ、世界で最も有名な美しい大通り。 高級ブティック、カフェ、劇場が並び、パリの華やかさを象徴する場所です。 「世界で最も美しい通り」と呼ばれ、散策するだけで気分が高揚します。 カフェのテラス席で道行く人々を眺めるのも、パリならではの楽しみ方。 クリスマスシーズンのイルミネーションは特に幻想的でロマンチックです。 パリの華やかさとエレガンスが凝縮された、この通りを闊歩しましょう。,/images/tourist_spot/059.jpg
60,19,モン・サン・ミッシェル修道院,海に浮かぶようにそびえ立つ、幻想的な世界遺産の修道院。 潮の満ち引きによって、陸地から孤立する姿は「西洋の驚異」と呼ばれます。 中世に建てられたロマネスク様式とゴシック様式の建築美に圧倒されます。 修道院の内部や屋上からは、広大な湾の美しい景色を一望できます。 特に朝焼けや夕暮れ時、夜のライトアップされた姿は息をのむ美しさ。 フランスの歴史と信仰、そして自然が融合した奇跡の場所を体験してください。,/images/tourist_spot/060.jpg
61,20,プロムナード・デ・ザングレ,地中海のリゾート地ニースの象徴、青く輝く海沿いの有名な遊歩道。 ヤシの木が並び、美しいビーチと紺碧の海を眺めながら散策を楽しめます。 高級ホテルやカジノが建ち並び、優雅で華やかな雰囲気に満ちています。 日光浴やジョギング、サイクリングを楽しむ人々で賑わう、開放的な空間。 夕暮れ時、空がオレンジ色に染まる光景は、格別の美しさです。 コート・ダジュールの優雅なバカンス気分を味わいましょう。,/images/tourist_spot/061.jpg
62,20,旧市街,ニースの歴史と活気が詰まった、迷路のような細い路地が魅力の地区。 カラフルな建物が並び、地元の食材や花が並ぶ市場が賑わいを見せます。 地元の料理を提供するレストランや、おしゃれなブティックが点在。 イタリア文化の影響を強く受けた、ニース独自の雰囲気を楽しめます。 ニース城跡へのアクセスも良く、歴史散策の拠点としても最適です。 迷い込むほどに楽しい、南仏の太陽と色に溢れた魅力的な空間です。,/images/tourist_spot/062.jpg
63,20,マセナ広場,ニースの中心にある、華やかで開放的な空間を持つ広場。 赤い建物と、白と黒の市松模様の石畳が特徴的な美しいデザインです。 広場には芸術的な彫刻や噴水が配され、市民や観光客の憩いの場となっています。 トラムが行き交い、ショッピング街へのアクセスも抜群の便利なロケーション。 ニースの活気と芸術的な雰囲気を肌で感じられる中心地です。 南仏の明るい日差しのもと、ゆったりとした時間を過ごしましょう。,/images/tourist_spot/063.jpg
64,20,ニース城跡,かつてニースを見下ろしていた城の跡地で、今は最高の展望台となっています。 眼下には、プロムナード・デ・ザングレと旧市街の美しい街並みが広がります。 特に、旧市街と地中海、港を一望するパノラマは息をのむ絶景です。 エレベーターまたは階段でアクセスでき、美しい滝や公園もあります。 ニースの街全体を写真に収めたいなら、必ず訪れるべき場所です。 コート・ダジュールの美しさを上から堪能する特等席へどうぞ。,/images/tourist_spot/064.jpg
65,21,フルヴィエールの丘,リヨンの街を見下ろす高台に位置し、旧市街を一望できる絶景スポット。 丘の上には、美しい白亜のノートルダム・ド・フルヴィエール大聖堂が建ちます。 古代ローマ時代の劇場跡など、リヨンの歴史を感じる遺跡も点在。 昼間の壮大なパノラマはもちろん、夜景もロマンチックで有名です。 リヨンの街の歴史と、ローヌ川・ソーヌ川が流れる雄大な風景を堪能できます。 フランス屈指の美食の街を上から見つめ、その魅力を再発見しましょう。,/images/tourist_spot/065.jpg
66,21,リヨン旧市街,ソーヌ川沿いに広がる、ルネサンス建築が残る美しい中世の街並み。 ユネスコ世界遺産に登録されており、石畳の路地を散策するのが楽しい場所です。 「トラブール」と呼ばれる抜け道を通ると、建物の裏庭や中庭に迷い込めます。 リヨンの伝統的なビストロ「ブション」で、美食の真髄を味わいましょう。 歴史的な雰囲気の中で、リヨンの美食と文化をじっくりと楽しんでください。 フランスの歴史と美食が詰まった、魅力的な散策エリアです。,/images/tourist_spot/066.jpg
67,21,壁画,リヨンには街の歴史や文化を題材とした、巨大な「トロンプルイユ（だまし絵）」の壁画が点在。 まるで本物の建物や人物がそこにいるかのような、緻密な描写に驚かされます。 特に「カニュの壁」や「リヨン人たちの壁」は必見で、街の歴史を物語っています。 街歩きの途中で突如現れるアートに、思わず立ち止まってしまうでしょう。 街全体が巨大な美術館のような、リヨンならではのユニークなアート体験。 リヨンの創造性とユーモアを感じられる、面白い観光スポットです。,/images/tourist_spot/067.jpg
68,22,シャンボール城,フランソワ1世の夢が詰まった、ルネサンス様式の壮麗で巨大な城。 レオナルド・ダ・ヴィンチの設計が関わったとされる「二重螺旋階段」は必見です。 広大な敷地と、その圧倒的なスケールは「フランスの至宝」とも呼ばれます。 城の周囲の森はかつて狩猟場として使われ、自然との調和も魅力です。 フランス王家の華やかな歴史と、ルネサンス芸術の頂点を体感できます。 ロワール地方で最も壮大でドラマチックな城を訪れましょう。,/images/tourist_spot/068.jpg
69,22,シュノンソー城,シェール川に優雅にまたがる姿が「水上の貴婦人」と呼ばれる美しい城。 カトリーヌ・ド・メディシスやディアーヌ・ド・ポワチエなど、歴史上の女性たちが愛しました。 城内には、彼女たちの個性と美意識が反映された豪華な装飾が残ります。 優美な庭園も美しく、ロマンチックで物語性に満ちた雰囲気を持っています。 女性の愛憎が渦巻いた歴史を感じる、ロワールで最もロマンチックな城。 優雅な姿と歴史の物語に心を奪われること間違いなしです。,/images/tourist_spot/069.jpg
70,22,シェヴェルニー城,白く均整の取れた美しい姿が特徴の、貴族の居城として愛されてきた城。 漫画『タンタンの冒険』に登場するムーランサール城のモデルとしても有名です。 城内の豪華な内装は保存状態が良く、当時の生活を垣間見ることができます。 広大な敷地内には、犬舎やボート遊びができる運河など、見どころが豊富。 ロワール地方で唯一、今も城主が暮らす生活感のある城としても知られています。 気品あふれる美しい姿と、アットホームな雰囲気を併せ持つ城です。,/images/tourist_spot/070.jpg
71,23,ハノイ旧市街,「36通り」と呼ばれる、活気あふれる迷路のような古都の商業地区。 通りごとに扱う商品が異なり、ベトナムの伝統的な生活文化が息づいています。 バイクや屋台がひしめき合い、エネルギッシュで独特な雰囲気が魅力。 安くて美味しいベトナム料理の屋台や、カフェで休憩するのも楽しい場所。 ハノイの伝統と日常が凝縮された、歩くだけで楽しい空間です。 ベトナムの喧騒と活気を肌で感じ、アジアのエネルギーをチャージしましょう。,/images/tourist_spot/071.jpg
72,23,ホー・チ・ミン廟,ベトナム建国の父、ホー・チ・ミン主席の遺体が永久保存されている場所。 社会主義国家の厳粛な雰囲気が漂い、愛国心と歴史の重みを感じさせます。 衛兵交代式は必見で、その厳格な儀式は見る者を惹きつけます。 服装には規定があり、肌の露出を控えるなど敬意が必要です。 ベトナムの歴史における最重要人物に敬意を払う場所です。 厳粛な雰囲気の中で、ベトナムの近現代史を深く感じてください。,/images/tourist_spot/072.jpg
73,23,ハノイ大教会,ハノイ旧市街に突如現れる、壮麗なネオ・ゴシック様式の大聖堂。 フランス植民地時代の面影を残し、異文化が交差するハノイを象徴しています。 内部のステンドグラスや装飾も美しく、静かで厳かな空間が広がります。 教会の前は市民の憩いの場となっており、カフェで休憩するのもおすすめ。 アジアの活気ある街並みの中で、ヨーロッパの歴史を感じられる場所です。 ハノイの賑わいの中の静寂、そのコントラストを楽しみましょう。,/images/tourist_spot/073.jpg
74,23,ホアンキエム湖,ハノイ旧市街の中心に位置する、市民の憩いの場となっている美しい湖。 湖面に浮かぶ玉山祠と、その神秘的な伝説が街のシンボルです。 早朝には太極拳をする人々が集まり、夕方は散歩を楽しむ人でにぎわいます。 週末は周辺が歩行者天国になり、さらに賑やかな雰囲気に包まれます。 ハノイの歴史と人々の生活を静かに見守る、オアシスのような存在。 湖畔を散策し、ハノイの穏やかで美しい日常を感じてください。,/images/tourist_spot/074.jpg
75,24,ミーケービーチ,長く白い砂浜と、透き通った青い海が魅力の、ベトナムを代表するビーチ。 ビーチ沿いにはリゾートホテルやシーフードレストランが立ち並びます。 穏やかな波はマリンスポーツに最適で、日光浴や海水浴を楽しめます。 かつては戦争の歴史もある場所ですが、今は平和なリゾートとして人気。 新鮮なシーフードを味わいながら、ベトナムの美しい海を満喫しましょう。 解放感あふれる空間で、心ゆくまでリラックスしてください。,/images/tourist_spot/075.jpg
