id,region_id,name,description,image_url
76,24,五行山,大理石でできた５つの連山からなり、石灰岩の洞窟と仏教寺院が点在。 山頂からの眺めは、ダナンの街とミーケービーチを一望する絶景です。 洞窟内には仏像が祀られ、神秘的で厳かな雰囲気に包まれています。 エレベーターまたは階段で登頂でき、気軽にトレッキングを楽しめます。 自然の造形美と、人々の信仰が融合したベトナムのパワースポット。 山頂からのパノラマと、神秘的な洞窟探検を楽しみましょう。,/images/tourist_spot/076.jpg
77,24,ロン橋,ハン川に架かる、巨大な龍の形をしたユニークなデザインの橋。 週末の夜には、この龍の口から火や水が噴き出すショーが開催されます。 夜になるとカラフルにライトアップされ、ダナンの街の夜景を彩ります。 ダナンの新しいシンボルとして、街の発展を象徴しています。 火を噴く龍のショーは迫力満点で、必ず訪れるべきエンターテイメント。 ダナンの活気と遊び心が感じられる、ユニークな観光スポットです。,/images/tourist_spot/077.jpg
78,24,バナヒルズ,"標高1,500mの山頂に広がる、フランス風のテーマパーク。 世界最長のケーブルカーに乗って、山頂までの絶景の空中散歩を体験。 巨大な手の彫刻が橋を支える「ゴールデンブリッジ」はSNSで大人気。 涼しい気候と、ヨーロッパの古城のような建築が非日常を演出します。 ダナンの海辺の暑さを忘れ、山の上でファンタジーの世界を満喫。 ベトナムの自然とヨーロッパの文化が融合した、ユニークな場所です。",/images/tourist_spot/078.jpg
79,25,ホイアン旧市街,17世紀の国際貿易港の面影を残す、美しい古都の街並み。 黄色い壁の建物と、色鮮やかなランタンが織りなす幻想的な景観が魅力です。 夜になるとランタンが一斉に灯り、ノスタルジックな雰囲気に包まれます。 洋服のオーダーメイドや、工芸品のショッピングも楽しめます。 世界中を旅した商人が残した、歴史と文化が凝縮された空間です。 ランタンの光の下、古都のロマンチックな雰囲気に浸りましょう。,/images/tourist_spot/079.jpg
80,25,日本橋,17世紀に日本人商人によって架けられたとされる、ホイアンの象徴的な橋。 屋根付きのユニークな構造が特徴で、ベトナムと日本の交流の歴史を物語ります。 橋のたもとには、猿と犬の像が配され、干支にまつわる伝説があります。 ホイアン旧市街の中でも特に人気の高い、歴史的なランドマークです。 異国情緒あふれる街並みに溶け込む、日本文化の足跡を見つけましょう。 静かな水辺にたたずむ、歴史のロマンを感じる場所です。,/images/tourist_spot/080.jpg
81,25,ランタン,ホイアンの街を彩る、シルクや竹で作られた色鮮やかな提灯。 昼間は街の至るところで売られ、夜には一斉に灯されて街を幻想的に照らします。 毎月旧暦14日の満月には「ランタン祭り」が開催され、一層華やかに。 色とりどりの光が水面に映る様子は、まさに写真映えする絶景です。 ホイアンの夜をロマンチックに演出する、街の魂とも言える存在。 ランタンの優しい光の下で、夢のようなひとときを過ごしましょう。,/images/tourist_spot/081.jpg
82,26,サイゴン大教会,ホーチミン市の中心に建つ、フランス植民地時代に建てられた赤レンガの教会。 すべての建材がフランスから運ばれたという、歴史的な背景を持っています。 教会前には「平和の聖母像」が立ち、市民の信仰の象徴となっています。 ホーチミンの街の喧騒の中の静寂を感じられる場所です。 フランスの影響とベトナムの歴史が交差する、象徴的な建築物。 植民地時代の面影を探しながら、その美しい姿を眺めてみましょう。,/images/tourist_spot/082.jpg
83,26,中央郵便局,エッフェル塔の設計者、エッフェルが手掛けたとも言われる美しい建築物。 黄色い外観と、アーチ状の天井が特徴的な、壮麗なフレンチ・コロニアル様式。 現在も郵便局として現役で使われており、お土産に手紙を送るのもおすすめ。 内部には古地図やホー・チ・ミン主席の肖像画が飾られ、歴史を感じさせます。 優雅な空間で、ベトナムとフランスの歴史が交差する雰囲気を味わえます。 ホーチミンの街の喧騒を忘れさせる、レトロで美しい公共建築です。,/images/tourist_spot/083.jpg
84,26,統一会堂,ベトナム戦争の終結の舞台となった、歴史的に重要な建物。 旧南ベトナムの大統領官邸として使われていた、モダンな建築が特徴です。 内部には当時の大統領執務室や会議室などがそのまま保存されています。 地下には作戦指令室があり、緊迫した戦争の雰囲気を追体験できます。 ベトナムの激動の近現代史を学ぶ上で欠かせない場所。 戦争の記憶と平和への願いが詰まった、歴史的な空間を訪れましょう。,/images/tourist_spot/084.jpg
85,26,クチトンネル,ベトナム戦争中にベトコンが使用した、地下に張り巡らされた巨大なトンネル網。 医療室、会議室、台所など、当時の生活の様子を垣間見ることができます。 実際にトンネルの一部を潜り抜ける体験は、戦争の過酷さを物語ります。 罠や武器など、当時の工夫と知恵を感じられる展示も興味深い。 ベトナムの抵抗の歴史と、人々の不屈の精神を学ぶ場所です。 歴史的な現場で、戦争のリアルを体験してみませんか。,/images/tourist_spot/085.jpg
86,26,ベンタイン市場,ホーチミン市の中心に位置する、活気あふれる巨大な市場。 食料品から衣料品、お土産まで、あらゆるものが手に入るカオスな空間。 市場の周囲には屋台が並び、安くて美味しいベトナム料理を楽しめます。 ベトナムの日常生活と、商売のエネルギーを肌で感じられます。 交渉しながら買い物をするのも、市場ならではの醍醐味です。 ホーチミンの「今」の活気を体感できる、エキサイティングな場所です。,/images/tourist_spot/086.jpg
87,27,ユングフラウヨッホ,"「ヨーロッパの頂上」と呼ばれる、標高3,454mにある展望台。 ヨーロッパで最も標所に高い鉄道駅があり、氷河の絶景が目の前に広がります。 スフィンクス展望台や氷の宮殿など、雪と氷の世界を楽しめます。 世界自然遺産の雄大なアレッチ氷河を眼下に眺める、感動的な体験。 夏でも雪が積もる場所で、アルプスの壮大な自然の力を感じましょう。 一生に一度は訪れたい、スイスアルプスの最高峰の絶景です。",/images/tourist_spot/087.jpg
88,27,クライネ・シャイデック,アイガー、メンヒ、ユングフラウの三名山を望む、絶景の峠。 ユングフラウヨッホへの登山鉄道が発着する、アルプスの拠点駅。 目の前に迫るアイガー北壁の雄大さは、見る者を圧倒します。 のんびりとハイキングを楽しんだり、山岳リゾートの雰囲気を味わえます。 スイスアルプスの最も有名な山々の迫力を間近で感じられる場所。 絵画のような景色の中で、心ゆくまでアルプスの自然を堪能してください。,/images/tourist_spot/088.jpg
89,27,インターラーケン,トゥーン湖とブリエンツ湖に挟まれた、ユングフラウ観光の玄関口。 ユングフラウ地方へのアクセスが良く、アクティビティの中心地でもあります。 パラグライダーやバンジージャンプなど、エキサイティングな体験が充実。 街からはアイガーなどの山々を望むことができ、リゾート感あふれる雰囲気。 美しい自然とスリル満点のアクティビティを楽しめる街です。 スイスアルプスの旅の拠点として、活気あふれる街に滞在しましょう。,/images/tourist_spot/089.jpg
90,28,バーンホフ通り,チューリッヒ中央駅からチューリッヒ湖まで続く、世界屈指の高級ショッピングストリート。 高級ブランド店や宝石店、時計店が軒を連ねる、エレガントな通りです。 路面電車が通り、ヨーロッパらしい落ち着いた雰囲気を持っています。 スイスの高品質な製品と、洗練された都会の雰囲気を味わえる場所。 買い物だけでなく、美しい街並みを散策するだけでも楽しめます。 世界的な金融都市チューリッヒのエレガンスを感じてみましょう。,/images/tourist_spot/090.jpg
91,28,グロスミュンスター大聖堂,チューリッヒのシンボルであり、双塔が特徴的なロマネスク様式の大聖堂。 スイスの宗教改革の中心地となった、歴史的に重要な教会です。 塔に登れば、チューリッヒ市街とリマト川の美しい景色を一望できます。 シャガールやジャコメッティによるステンドグラスも必見。 チューリッヒの街の歴史と、その文化的な深さを感じられる場所です。 荘厳な建築の中で、スイスの歴史に思いを馳せましょう。,/images/tourist_spot/091.jpg
92,28,フラウミュンスター,リマト川沿いに建つ、かつて修道院だった美しい教会。 特に、マルク・シャガールがデザインした五枚のステンドグラスが有名です。 光によって色彩が変化するシャガールの絵画は、幻想的な美しさ。 ゴシック様式の建築と、近代芸術が融合した独特な空間を持っています。 チューリッヒ湖から流れ出るリマト川沿いの、静かで美しいスポット。 シャガールのアートの光に包まれる、感動的な体験をどうぞ。,/images/tourist_spot/092.jpg
93,28,チューリッヒ湖,チューリッヒ市の南東に広がる、雄大で美しい湖。 湖畔は公園や遊歩道として整備され、市民の憩いの場となっています。 遊覧船に乗って、湖上からのチューリッヒの街並みとアルプスの眺めを楽しむのもおすすめ。 夏には湖水浴を楽しむ人々で賑わい、リゾートのような雰囲気になります。 都会の喧騒を忘れさせてくれる、癒やしと安らぎの空間。 スイスの大自然と都会の調和を感じられる場所です。,/images/tourist_spot/093.jpg
94,29,カペル橋,ルツェルン湖から流れ出るロイス川に架かる、ヨーロッパ最古の木造の橋。 屋根の下には、ルツェルンの歴史を描いた三角の板絵が並んでいます。 中世の趣を残す美しい橋は、ルツェルンの街の象徴となっています。 花で飾られた欄干と、背後のイエズス教会とのコントラストが美しい。 火災からの復旧を経て、市民に愛され続ける歴史的なランドマークです。 水面に映る美しい姿を眺めながら、ルツェルンの歴史を感じてください。,/images/tourist_spot/094.jpg
95,29,ライオン記念碑,「世界で最も悲しいライオン」と称される、岩壁に刻まれた巨大な彫刻。 フランス革命時に戦死したスイス傭兵の忠誠心を讃えて作られました。 その表情は苦悩に満ち、見る者に深い感動と悲哀を与えます。 記念碑の周りは静かな公園になっており、散策するのに適しています。 ルツェルンの歴史と、スイス傭兵の悲しい物語を伝えるモニュメント。 忠誠心と悲劇の歴史を感じる、深く心に残る場所です。,/images/tourist_spot/095.jpg
96,29,ルツェルン湖,スイス中央部に位置し、「スイスの心臓」と呼ばれる美しい湖。 四方を山々に囲まれ、湖畔には中世の趣を残すルツェルンの街が広がります。 遊覧船に乗れば、湖上からピラトゥス山などの雄大な景色を楽しめます。 穏やかな湖面と、周囲の自然が織りなす絵画のような風景。 スイスの美しさが凝縮された、静かでロマンチックな場所です。 湖畔の散策や船旅で、心ゆくまで絶景を堪能しましょう。,/images/tourist_spot/096.jpg
97,29,ピラトゥス山,ルツェルン市街のすぐ近くにそびえる、伝説に満ちた山。 世界一急勾配の登山鉄道や、ロープウェイで山頂まで登頂できます。 山頂からは、ルツェルン湖やアルプスの山々の大パノラマを一望できます。 伝説の龍が住んでいたと言われる、神秘的な雰囲気を持つ場所。 様々な乗り物を乗り継ぎながら、山頂の絶景を目指す楽しい体験。 スイスの自然と伝説、そして絶景が楽しめる人気の観光スポットです。,/images/tourist_spot/097.jpg
98,30,マッターホルン,鋭いピラミッド型の山容を持つ、世界で最も有名な山の一つ。 その威厳ある姿は、スイスアルプスの象徴として人々を魅了し続けます。 朝焼けや夕焼けに染まる姿は特に美しく、感動的な光景です。 ツェルマットの街のどこからでも、その雄大な姿を眺めることができます。 人類の挑戦の歴史が詰まった、アルプスの孤高の美を体感してください。 見る者の魂を揺さぶる、山岳景観の最高傑作です。,/images/tourist_spot/098.jpg
99,30,ゴルナーグラート展望台,マッターホルンを最も美しく、最も間近に眺められる展望台の一つ。 登山鉄道に乗って登頂し、目の前に広がる大氷河と29の4000m級の山々を望めます。 特に、逆さマッターホルンが映る湖の景色は、絶好のフォトスポット。 展望台からのパノラマは、スイスアルプスの壮大さを体感できます。 マッターホルンをはじめとする名峰群の、息をのむ絶景を堪能しましょう。 アルプスの大自然の力を全身で感じられる場所です。,/images/tourist_spot/099.jpg
100,30,マッターホルン・グレッシャー・パラダイス,"ヨーロッパで最も高い地点にあるロープウェイ駅（標高3,883m）にある展望台。 一年中雪と氷に覆われた世界で、氷の宮殿や展望台が楽しめます。 ここからはマッターホルンの裏側や、イタリア側のアルプスも一望できます。 スキーやスノーボードも夏でも楽しめ、まさに氷河の楽園。 標高が高いため防寒対策は必須ですが、特別な体験が待っています。 アルプスの頂で、究極の雪と氷の絶景を体験しましょう。",/images/tourist_spot/100.jpeg
101,31,オペラハウス,シドニー湾に浮かぶ、貝殻のようなユニークなデザインが特徴の世界遺産。 20世紀を代表する建築物として、シドニーのシンボルとなっています。 オペラやコンサート、演劇などが上演される、芸術と文化の発信地。 ハーバーブリッジを背景にしたその姿は、最高のフォトジェニックな景観です。 昼間の白く輝く姿も、夜のライトアップされた姿も感動的な美しさ。 シドニーのモダンな美しさと芸術の魂を感じられる場所です。,/images/tourist_spot/101.jpg
102,31,ハーバーブリッジ,シドニー湾に架かる巨大な鋼鉄製のアーチ橋で、「ハンガー（ハンガー）」の愛称で親しまれます。 橋の上からのシドニー湾とオペラハウスの眺めは、絶景の一言。 「ブリッジクライム」では、橋のアーチの頂上まで登るスリル満点の体験ができます。 シドニーの港と街を結ぶ、力強く美しい鉄の構造物。 街の喧騒を離れ、シドニーの息をのむようなパノラマビューを堪能しましょう。 シドニーの象徴的な景色を、体全体で感じてください。,/images/tourist_spot/102.jpg
103,31,ボンダイビーチ,シドニーを代表する、長く白い砂浜と透き通った青い海が広がる人気のビーチ。 サーフィン文化の中心地で、多くの人々が波乗りや日光浴を楽しんでいます。 ビーチ沿いにはおしゃれなカフェやレストランが並び、活気にあふれています。 「ボンダイ・トゥ・クージー」の海岸沿いの散歩道からの眺めも絶景。 オーストラリアの開放的なビーチカルチャーを肌で感じられる場所。 太陽と海、そして人々のエネルギーが溢れる場所でリラックスしましょう。,/images/tourist_spot/103.jpg
104,31,ロックス地区,シドニー入植当初の面影を残す、歴史と情緒あふれる石畳の古い街並み。 かつて船員や囚人が暮らした場所で、歴史的なパブや建物が多く残ります。 週末にはマーケットが開かれ、手作りの工芸品やお土産を探す楽しみも。 ハーバーブリッジのたもとに位置し、オペラハウスへのアクセスも良好。 シドニーのルーツと、歴史的な雰囲気を深く感じられる場所です。 オーストラリアの過去に思いを馳せながら、散策を楽しんでください。,/images/tourist_spot/104.jpg
105,31,ダーリングハーバー,近代的な再開発により生まれた、レストランやエンターテイメント施設が集まる港湾エリア。 水族館や動物園、博物館など、大人から子供まで楽しめるスポットが充実。 ウォーターフロントのテラス席で食事をすれば、最高の気分を味わえます。 夜になると周辺のビルや施設がライトアップされ、美しい夜景が広がります。 シドニーのモダンで賑やかな側面を感じられる、楽しい複合施設です。 都会的な雰囲気の中で、美味しい食事とエンタメを満喫しましょう。,/images/tourist_spot/105.jpg
106,32,ウルル,オーストラリアの聖地であり、世界最大級の一枚岩として知られる巨大な岩山。 アボリジニにとって神聖な場所であり、その歴史と信仰の重みを感じさせます。 朝焼けや夕焼けの時間帯には、岩肌の色がドラマチックに変化する絶景。 その壮大なスケールと、大地のエネルギーに圧倒されること間違いなし。 オーストラリアの大自然と、先住民の文化に触れる貴重な体験。 あなたの人生観を変えるかもしれない、神聖な場所を訪れましょう。,/images/tourist_spot/106.jpg
107,32,カタ・ジュタ,ウルルの近くに位置する、36の巨大な岩のドーム群からなる景勝地。 「多くの頭」を意味し、ウルルと同様にアボリジニにとって神聖な場所です。 「風の谷」などのウォーキングトレイルでは、岩の間を歩くことができます。 ウルルとは異なる、ゴツゴツとした力強い造形美が魅力。 ウルルとセットで訪れ、オーストラリアのもう一つの壮大な自然の驚異を体験。 大地の息吹と、雄大な景色の迫力を全身で感じてください。,/images/tourist_spot/107.jpg
108,32,カルチャーセンター,ウルル・カタ・ジュタ国立公園内にある、アボリジニ文化を学べる施設。 先住民アナング族の歴史、信仰、伝統芸術について深く学ぶことができます。 アボリジニのガイドによるツアーもあり、神聖な地の物語を聞くことができます。 この土地の真のオーナーである人々の、深い知恵と歴史に触れましょう。 自然を敬い、生きる知恵を伝える、アボリジニの文化を理解する入口です。 ウルル訪問をより意味深いものにするために、ぜひ訪れるべき場所です。,/images/tourist_spot/108.jpg
109,33,グレート・バリア・リーフ,世界最大のサンゴ礁地帯であり、宇宙からも見えると言われる巨大な自然遺産。 色とりどりのサンゴと、数千種の熱帯魚が生息する海洋生物の宝庫。 シュノーケリングやダイビングで、この幻想的な海中世界を探検できます。 セスナやヘリコプターからの「ハート・リーフ」の眺めもロマンチック。 地球が作り出した奇跡の海で、忘れられない感動体験を。 手つかずの自然の美しさと、海洋生物の多様性に触れてみませんか。,/images/tourist_spot/109.jpg
110,33,キュランダ,「熱帯雨林の村」として知られ、自然と先住民文化が息づく静かな観光地。 世界最長のゴンドラ「スカイレール」からの熱帯雨林の眺めは圧巻です。 キュランダ鉄道に乗って、壮大な滝や渓谷を巡るノスタルジックな旅も人気。 マーケットでは、アボリジニのアートや工芸品を購入できます。 熱帯雨林の静けさと、オーストラリアの先住民文化に触れる場所。 ケアンズの喧騒を離れ、ゆったりとした自然の時間を過ごしましょう。,/images/tourist_spot/110.jpg
111,33,グリーン島,グレート・バリア・リーフに浮かぶ、美しいサンゴと熱帯雨林に覆われた島。 ケアンズから高速船で約45分とアクセスが良く、日帰り観光に最適です。 ビーチでリラックスしたり、グラスボートでサンゴ礁を観察できます。 シュノーケリングやダイビングで、手軽に海中世界を探検可能。 美しい海と白い砂浜に囲まれた、まさに熱帯の楽園。 グレート・バリア・リーフの魅力を手軽に堪能できる場所です。,/images/tourist_spot/111.jpg
112,33,デインツリー熱帯雨林,世界最古の熱帯雨林として知られ、太古の植物や珍しい生物が生息する世界遺産。 海と熱帯雨林が隣接する、世界でも珍しい独特の景観が魅力です。 キャノピーウォークなどで、熱帯雨林の巨大な植物を間近で観察。 ワニが生息する川をクルーズしたり、エキゾチックな体験ができます。 地球の進化の歴史を感じられる、神秘的で壮大な自然の宝庫。 太古から変わらない、生命力あふれるジャングルの奥深くを探検しましょう。,/images/tourist_spot/112.jpg
113,34,グレート・オーシャン・ロード,メルボルン近郊の海岸沿いを走る、世界屈指の美しいドライブコース。 荒々しい波によって削られた奇岩群「十二使徒」の絶景は圧巻です。 断崖絶壁が続く海岸線と、青い海のコントラストは息をのむ美しさ。 ドライブだけでなく、ヘリコプターからの空撮も人気を集めています。 自然の驚異と、雄大な海岸線の美しさを体感できる場所。 オーストラリアのワイルドでドラマチックな自然を感じてください。,/images/tourist_spot/113.jpg
114,34,フリンダース・ストリート駅,メルボルンのシンボルであり、ビクトリア様式の美しい黄色い駅舎。 時計台の下で待ち合わせをする、メルボルン市民の日常の中心地。 夜になるとライトアップされ、ロマンチックな雰囲気を醸し出します。 メルボルンの歴史と、ヨーロッパのような雰囲気を象徴する建築。 この美しい駅舎を背景に、メルボルンの旅の始まりを記念しましょう。 街の活気と歴史を感じられる、美しいランドマークです。,/images/tourist_spot/114.jpg
115,34,王立植物園,メルボルン市街の中心にある、広大で手入れの行き届いた美しい植物園。 世界中から集められた様々な植物が植えられ、四季折々の美しさが楽しめます。 湖畔や芝生でのんびりピクニックをする、市民の憩いの場。 メルボルンの都会の喧騒を忘れさせてくれる、緑豊かなオアシス。 美しい花々や珍しい植物を眺めながら、ゆったりとした時間を過ごしましょう。 メルボルンの自然と安らぎを感じられる最高の場所です。,/images/tourist_spot/115.jpg
