id,region_id,name,description,image_url
1,2,ラスベガス,夜空を焦がすネオンの光、世界最高峰のエンターテイメントが集結する「不夜城」。 豪華絢爛なカジノで一攫千金を夢見たり、一流シェフのグルメに舌鼓を打ったり。 息をのむようなシルク・ドゥ・ソレイユのショーや、有名DJの熱狂的なパフォーマンス。 ベネチアのゴンドラやパリのエッフェル塔を再現したホテル街を歩けば、世界旅行気分に。 刺激と非日常に満ちた、大人のための最高の遊び場があなたを待っています。 一晩で人生が変わるかもしれない、究極の興奮を体験してみませんか。,/images/tourist_spot/001.jpg
2,1,自由の女神,アメリカの自由と民主主義の象徴として、100年以上にわたりニューヨーク港を見守る巨大な女神像。 台座や冠の展望台からは、マンハッタンのスカイラインとハドソン川の雄大な景色を一望できます。 移民たちが新世界への希望を胸に見た、歴史的な感動を追体験。 フェリーで海風を感じながら近づく姿は、まさに映画のワンシーンのようです。 アメリカンドリームの始まりを感じさせる、威厳と希望に満ちたその姿を間近でご覧ください。 世界に誇るこのモニュメントの前で、新たな決意を胸に刻みましょう。,/images/tourist_spot/002.jpg
3,1,ハリウッド,夢を追いかける人々の街、世界の映画産業の中心地。 「ハリウッド・サイン」を背景に記念写真を撮り、スターの仲間入り気分を味わいましょう。 ハリウッド大通りでは、有名俳優たちの手形やサインが刻まれた「ウォーク・オブ・フェーム」を散策。 TCLチャイニーズ・シアターで、お気に入りのスターの足跡を見つけるのも楽しみの一つです。 映画史の栄光と、現代のエンターテイメントが交差するこの場所で、あなただけのストーリーを見つけてください。 誰もが知る“あの”場所で、きらめく才能の気配を感じましょう。,/images/tourist_spot/003.jpg
4,3,グランド・キャニオン国立公園,"地球の歴史が刻まれた、深さ1,600m、長さ450kmにも及ぶ大渓谷。 悠久の時が作り上げた壮大な景色は、人間の想像力をはるかに超える自然の芸術です。 朝焼けや夕焼けの時間帯には、刻々と色を変える岩肌が息をのむような美しさを演出。 サウスリムの展望台から見下ろす谷底、ハイキングで感じる大地の鼓動。 この圧倒的なスケールと静寂の中で、日常を忘れ、地球の雄大さに心を洗われる体験を。 あなたの人生観を変えるかもしれない、世界最高の絶景がここにあります。",/images/tourist_spot/004.jpg
5,4,メトロポリタン美術館,古代から現代まで、世界中の文明と芸術を網羅する巨大な殿堂。 エジプトの神殿や、ヨーロッパの巨匠たちの絵画、アジアの美術品など、膨大なコレクションを所蔵しています。 一日では回りきれないほどの至宝の数々が、時を超えた感動を与えてくれます。 ルーフガーデンからのマンハッタンの眺めもまた、特別なアート体験の一つです。 世界最高峰の美と歴史に触れる知的興奮を、この「The Met」で味わいましょう。 知識と感性を刺激する、ニューヨークの文化の心臓部へようこそ。,/images/tourist_spot/005.jpg
6,4,ブロードウェイ,世界中から才能が集う、演劇・ミュージカルの最高峰。 華やかな舞台セット、迫力ある歌声とダンスに、観客は瞬く間に別世界へと引き込まれます。 誰もが知る名作から最新の話題作まで、連日熱い感動を届けるショーの数々。 劇場街の賑わいや、幕間に飛び交う興奮の声も、すべてが特別な思い出になります。 人生で一度は体験したい、本場のミュージカルの圧倒的なライブパフォーマンス。 忘れられない一夜の感動と興奮を、ぜひその目で、耳で感じてください。,/images/tourist_spot/006.jpg
7,5,ホワイトハウス,アメリカ合衆国の大統領が執務をとり、家族と暮らす、世界で最も有名な公邸の一つ。 世界政治の最前線であり続けるこの場所は、歴史の重みと権威を感じさせます。 整然とした外観は、アメリカの民主主義と強さを象徴する荘厳な美しさを放っています。 広大な敷地を囲むフェンス越しに、アメリカの「今」を感じる貴重な体験を。 アメリカの歴史と政治の中心地で、その威厳に満ちた雰囲気に触れてみましょう。 一国のリーダーの決断の場所が、あなたの目の前にあります。,/images/tourist_spot/007.jpg
8,5,ワシントン記念塔,初代大統領ジョージ・ワシントンを称える、ワシントンD.C.のシンボル的なオベリスク。 街の中心にそびえ立つ純白の塔は、力強さとアメリカの独立への敬意を象徴しています。 展望台からは、ナショナルモールを中心に広がるワシントンD.C.の街並みを360度見渡せます。 リンカーン記念館やホワイトハウスなど、重要な建築物を一望できる絶好のフォトスポットです。 青空を貫くその雄大な姿は、見る者に力強い感動とインスピレーションを与えてくれます。 この街のランドマークから、アメリカの歴史と希望を見つめ直しましょう。,/images/tourist_spot/008.jpg
9,6,ウォルト・ディズニー・ワールド・リゾート,"世界最大の夢と魔法の王国。４つのテーマパークと２つのウォーターパークで構成される巨大リゾートです。 シンデレラ城やスペース・マウンテンなど、誰もが知る象徴的なアトラクションが勢揃い。 最先端の技術と心温まるストーリーテリングが融合した、究極の没入体験が待っています。 キャラクターとのグリーティングや、夜空を彩る壮大な花火ショーは感動必至。 大人も子供も、日頃の現実を忘れ、純粋な喜びと興奮に満たされる場所。 あなたの""心のスイッチ""をオフにして、最高のファンタジーの世界に飛び込みましょう。",/images/tourist_spot/009.jpg
10,6,マイアミ・ビーチ,アール・デコ調の建物が立ち並ぶ活気ある街並みと、白く輝く砂浜が魅力のリゾート地。 透き通ったターコイズブルーの海と、ヤシの木が揺れる美しい景色が非日常を演出します。 オーシャンドライブ沿いのカフェやバーでは、ラテンの音楽と熱気を感じながら食事を。 日光浴やマリンスポーツを楽しむ人々で賑わう、解放感あふれる空間です。 昼はビーチでリラックス、夜はナイトライフを満喫できる、大人のためのパラダイス。 太陽とアート、そしてエキゾチックな文化が交差する、アメリカ屈指のビーチシティへ。,/images/tourist_spot/010.jpg
11,6,キーウェスト,フロリダ半島の最南端に位置する、カリブ海のような雰囲気を持つ美しい島。 文豪ヘミングウェイが愛したこの地は、独特ののんびりとした時間が流れています。 カラフルな家並みが並ぶ旧市街を散策し、島の歴史とアートを感じましょう。 特に、毎夕開催される「サンセット・フェスティバル」で見る夕陽は感動的。 新鮮なシーフードと名物「キーライムパイ」を味わいながら、至福のひとときを。 アメリカ本土にいながら、まるで異国に来たかのような自由なスピリットを感じてください。,/images/tourist_spot/011.jpg
12,1,グリフィス天文台,ロサンゼルスの街を一望する高台に位置し、宇宙の神秘に触れられる場所。 ドーム型のプラネタリウムでは、満天の星空と迫力ある宇宙旅行を体験できます。 ここから見下ろすハリウッドサインと、輝くロサンゼルスの夜景は息をのむ美しさ。 特に夕暮れ時は、空の色が変わり、街に光が灯るドラマチックな瞬間が訪れます。 映画『ラ・ラ・ランド』の舞台としても有名で、ロマンチックな雰囲気も満点。 科学と自然の驚異、そして最高の夜景が一度に楽しめる最高のスポットです。,/images/tourist_spot/012.jpg
13,1,ユニバーサル・スタジオ・ハリウッド,映画の世界に入り込み、ハリウッドの魔法を体験できるテーマパーク。 世界的に有名な映画をテーマにした、最新技術を駆使したスリル満点のアトラクション。 特に、映画のセットや制作過程を巡る「スタジオ・ツアー」は本場ならではの醍醐味。 『ハリー・ポッター』や『スーパー・ニンテンドー・ワールド』など人気エリアも充実。 映画ファンはもちろん、誰もが楽しめるエンターテイメントが詰まっています。 スクリーンの中の興奮を、ぜひこの場所で体感してください。,/images/tourist_spot/013.jpg
14,3,セドナ,地球のエネルギーが溢れる「ボルテックス」として知られる、スピリチュアルな聖地。 赤く燃えるような岩山が織りなす景色は、訪れる人々に癒しとインスピレーションを与えます。 雄大な自然の中でハイキングやヨガを体験し、心身をリフレッシュ。 パワースポット巡りや、クリスタルショップでの特別な出会いも楽しみの一つです。 街全体が特別な力を放ち、訪れるだけで心が浄化されるような感覚に包まれます。 大地のエネルギーを感じながら、自分自身と向き合う特別な旅に出かけませんか。,/images/tourist_spot/014.jpg
15,7,ワイキキビーチ（オアフ島）,ダイヤモンドヘッドを背景に広がる、世界で最も有名なビーチの一つ。 温暖な気候と穏やかな波が、初心者から上級者まで最高のサーフィン体験を提供します。 ビーチ沿いには、高級ホテルやショッピング、グルメスポットが集結し、利便性も抜群。 ヤシの木陰でリラックスしたり、サンセットを眺めながらロマンチックなひとときを。 ハワイの開放的な雰囲気と、アロハ・スピリットを感じられる中心地です。 この楽園で、永遠に忘れられないハワイの休日を満喫してください。,/images/tourist_spot/015.jpg
16,7,ダイヤモンドヘッド（オアフ島）,ワイキキの景色を完成させる、オアフ島の象徴的なランドマークの火山。 頂上までは約1.5時間で登頂可能で、初心者でも挑戦しやすいハイキングコース。 山頂にたどり着けば、青い海とワイキキの美しい街並みが眼下に広がる絶景が待っています。 早朝の日の出に合わせて登れば、感動的な光景に出会えるでしょう。 この場所から見る景色は、あなたのハワイ旅行の最高の思い出になるはずです。 少し汗をかいた先に待つ、オアフ島随一のパノラマビューを体験してください。,/images/tourist_spot/016.jpg
17,7,ハレアカラ国立公園（マウイ島）,"標高3,055mのハレアカラ火山の山頂を中心とする、壮大な景観の国立公園。 特に、雲海に浮かぶように昇る「日の出」は、世界中から観光客が集まる感動のスペクタクル。 まるで火星のような赤い大地が広がるクレーター内をハイキングすることも可能です。 固有種の植物や、珍しいハワイの自然に出会える貴重な場所でもあります。 極寒の山頂で、宇宙の静寂と地球の雄大さを肌で感じてみませんか。 地球上のものとは思えない、神秘的な景色があなたを待っています。",/images/tourist_spot/017.jpg
18,7,キラウエア火山（ハワイ島）,世界で最も活発な火山の一つで、今もなお活動を続ける自然の驚異。 国立公園内では、溶岩台地を歩き、蒸気が噴き出すクレーターの近くまで接近可能。 黒く固まった溶岩の上を歩けば、地球のエネルギーを肌で感じることができます。 噴火活動が活発な時期には、赤く光る溶岩が海に流れ込む幻想的な光景も。 生命の誕生と破壊を同時に見せてくれる、まさに「生きている地球」を体感しましょう。 自然の圧倒的な力を前に、言葉を失う感動があなたを包み込みます。,/images/tourist_spot/018.jpg
19,8,コロッセオ,古代ローマ帝国の栄光と悲劇の歴史が刻まれた、巨大な円形闘技場。 剣闘士や猛獣たちの激しい戦いが繰り広げられた、当時の熱狂を今に伝えています。 半壊した姿が逆に、悠久の時の流れと歴史の重みを強烈に感じさせます。 夜にはライトアップされ、昼間とは違う幻想的で荘厳な姿を見せてくれます。 ローマの最も象徴的なアイコンの一つで、紀元前のロマンスに思いを馳せましょう。 人類の歴史の壮大さと残酷さが凝縮された、必見の遺跡です。,/images/tourist_spot/019.jpg
20,8,フォロ・ロマーノ,かつて古代ローマの中心地として栄えた、政治、商業、宗教の活動の中心地。 広大な敷地には、神殿やバシリカ、凱旋門などの遺跡群が広がり、当時の繁栄を偲ばせます。 石畳を歩けば、ジュリアス・シーザーやマルクス・アウレリウスが歩いた道を辿る気分に。 丘の上から見下ろす全景は、まるでタイムスリップしたかのような感動を与えます。 ローマ帝国の日常と権力が集中した、歴史好きにはたまらない場所。 文明の礎となったこの場所で、千年の時を超えた静かな感動を味わいましょう。,/images/tourist_spot/020.jpg
21,8,トレヴィの泉,バロック様式の豪華絢爛な彫刻と、湧き出る清らかな水が美しい有名な泉。 コインを投げ入れるとローマに再訪できるという伝説で知られています。 夜になるとライトアップされ、彫刻のディテールが浮かび上がり、ロマンチックな雰囲気に。 映画『ローマの休日』の舞台としても有名で、訪れる人々を魅了し続けています。 願いを込めたコインを泉に投げ入れ、またこの美しい街に戻ってくることを祈りましょう。 ローマの喧騒の中にたたずむ、夢と美しさに満ちた空間です。,/images/tourist_spot/021.jpg
22,8,パンテオン,ローマ帝国時代に建設され、ほぼ完全な形で残る古代建築の傑作。 巨大なドーム天井にある、直径約9mの円形の穴「オクルス（目）」は必見です。 このオクルスから差し込む光が、時間とともに内部を巡る様子は神秘的で荘厳。 ラファエロなどの著名人が埋葬されている場所としても知られています。 古代ローマの建築技術の高さと、信仰の力に圧倒されること間違いなし。 完璧な調和と美しさを持つ、静かで神聖な空間を体験してください。,/images/tourist_spot/022.jpg
23,8,スペイン広場,ローマのショッピングと社交の中心地として賑わう、華やかで開放的な広場。 広場から延びる「スペイン階段」は、多くの人々が憩い、景色を楽しむ有名なスポットです。 階段を上り切ると、トリニタ・デイ・モンティ教会の美しい姿が目に飛び込んできます。 周辺には高級ブランド店が立ち並び、ウィンドウショッピングも楽しめます。 映画『ローマの休日』の舞台としても有名で、ヒロイン気分でジェラートを味わいましょう。 ローマの最もエレガントで活気ある雰囲気を満喫できる場所です。,/images/tourist_spot/023.jpg
24,9,サン・ピエトロ大聖堂,カトリック教会の総本山として、世界最大級の威容を誇る壮麗な大聖堂。 ミケランジェロの傑作『ピエタ』をはじめ、人類の至宝と呼べる芸術品の数々を所蔵しています。 ベルニーニ作の豪華な天蓋（バルダッキーノ）の下で、そのスケールに圧倒されます。 クーポラ（円蓋）に登れば、バチカン市国とローマ市街のパノラマを一望できます。 信仰心を超えた、歴史と芸術が凝縮された空間で厳かな時間を過ごしませんか。 建築と美術の極致を極めたこの場所で、神聖な感動を体験してください。,/images/tourist_spot/024.jpg
25,9,バチカン美術館（システィーナ礼拝堂）,歴代ローマ教皇が集めた、膨大な美術品と工芸品のコレクションを誇る美術館。 ハイライトは、ミケランジェロの『最後の審判』が描かれたシスティーナ礼拝堂。 天井画の壮大な迫力と色彩美は、まさに人類史上最高の芸術体験の一つです。 ラファエロの間など、他にも見どころが多く、人類の英知の結晶に触れられます。 長蛇の列に並んででも見る価値のある、世界屈指の至宝の数々がここに。 神に捧げられた美の空間で、時を超えた感動に浸りましょう。,/images/tourist_spot/025.jpg
26,10,ドゥオモ,フィレンツェの街のシンボルであり、ルネサンス建築の最高傑作の一つ。 ブルネレスキが設計した巨大なクーポラ（ドーム）は、その美しさと技術に驚嘆させられます。 クーポラに登れば、ルネサンスの街フィレンツェの赤い屋根の街並みを一望できます。 ジョットの鐘楼と洗礼堂も隣接し、その壮麗な外観は圧倒的な存在感です。 ルネサンスの栄光と情熱が凝縮された、イタリアの芸術都市の心臓部。 フィレンツェの街を彩るこの大聖堂で、偉大な歴史の息吹を感じてください。,/images/tourist_spot/026.jpg
27,10,ウフィツィ美術館,ルネサンス美術の傑作を世界で最も多く収蔵する、イタリア屈指の美術館。 ボッティチェリの『ヴィーナスの誕生』や『プリマヴェーラ』など、必見の作品が目白押し。 メディチ家が収集した膨大なコレクションを通して、華麗なルネサンス文化を辿れます。 芸術に飢えた心を潤す、イタリア絵画の歴史を学ぶ最高の場所です。 美の規範となったルネサンス芸術の真髄を、この場所でじっくりと堪能しましょう。 芸術の都フィレンツェが誇る、永遠の美に出会える場所です。,/images/tourist_spot/027.jpg
28,10,ヴェッキオ橋,アルノ川に架かる、フィレンツェ最古のロマンチックな石造りの橋。 橋の両側には宝石店や貴金属店が連なり、橋自体が一つの商店街となっています。 夕暮れ時、橋の上から眺めるアルノ川とフィレンツェの街の景色は格別。 かつては精肉店が並んでいたという歴史を持つ、ユニークな景観も魅力。 恋人たちの聖地としても知られ、ロマンチックな雰囲気に包まれています。 フィレンツェの歴史と商業、そして愛の物語が詰まった橋を渡りましょう。,/images/tourist_spot/028.jpg
29,10,ミケランジェロ広場,フィレンツェ市街を一望できる、最高のパノラマビューを持つ展望広場。 赤い屋根の街並み、ドゥオモのクーポラ、ヴェッキオ橋まで全てが視界に入ります。 夕暮れ時には、街が黄金色に染まり、息をのむような絶景に包まれます。 広場中央には、ミケランジェロ作『ダビデ像』のブロンズのレプリカがたたずみます。 フィレンツェの美しさを一望したいなら、まず訪れるべき場所です。 ルネサンスの街の全景を、あなたの記憶に焼き付けてください。,/images/tourist_spot/029.jpg
30,11,サン・マルコ広場,「ヨーロッパで最も美しい広間」と称される、ベネチアの政治・宗教の中心地。 ナポレオンが世界で最も美しいと讃えた歴史的な空間です。 広場を囲むサン・マルコ寺院、ドゥカーレ宮殿、鐘楼が荘厳な雰囲気を醸し出します。 カフェで優雅にエスプレッソを飲みながら、生演奏に耳を傾ける至福の時。 時には潮が満ちて水浸しになる「アクア・アルタ」も、この街ならではの風景です。 ベネチアの歴史と優雅さが凝縮されたこの広場で、非日常を味わいましょう。,/images/tourist_spot/030.jpg
31,11,サン・マルコ寺院,聖マルコの遺骸を祀る、ビザンチン様式とゴシック様式が融合した壮麗な大寺院。 内部はきらめく金色のモザイクで覆われ、「黄金の教会」とも呼ばれます。 数多くの戦利品が飾られており、ベネチア共和国の繁栄と権力の歴史を物語ります。 ギリシャ十字型の平面プランと５つのドームが特徴的な独特な建築美。 まばゆいばかりのモザイク画は、見る者を神聖な世界へと誘います。 ベネチアが誇る、東方と西方の文化が融合した芸術の極致をご覧ください。,/images/tourist_spot/031.jpg
32,11,ドゥカーレ宮殿,かつてのベネチア共和国の総督（ドージェ）の公邸であり、政治の中心地だった宮殿。 ゴシック様式とルネサンス様式が融合した、華麗で優美な外観が特徴です。 内部には、ヴェロネーゼやティントレットなど巨匠たちの豪華なフレスコ画が飾られています。 総督の豪華な居室や、暗く重い雰囲気の牢獄「ため息の橋」も必見。 ベネチア共和国の栄華と陰の歴史を、同時に感じられる場所です。 権力の象徴として栄えた、この水上都市の歴史の中心を探訪しましょう。,/images/tourist_spot/032.jpg
33,11,リアルト橋,ベネチアの主要な水路であるカナル・グランデに架かる最も有名な橋。 アーチ型の美しい姿は、ベネチアの観光写真には欠かせないアイコンです。 橋の上からは、ゴンドラが行き交うカナル・グランデの活気ある風景を一望できます。 かつては木造でしたが、再建され現在の石造りの優美な姿となりました。 ベネチアの商業の中心として栄えた歴史を感じさせる、賑やかなスポットです。 ゴンドラが行き交う水上の絶景を、この橋の上から眺めてみましょう,/images/tourist_spot/033.jpg
34,11,ゴンドラ遊覧,ベネチアの細い水路（カナル）を、ゴンドリエーレの歌声と共に優雅に進む体験。 水上からしか見られないベネチアの街の景色は、格別の美しさです。 石造りの建物の間を縫うように進むと、まるで迷宮に入り込んだような気分に。 ロマンチックなムード満点で、特に夕暮れ時は最高の思い出になるでしょう。 ベネチアを訪れたなら、絶対に外せない水上都市ならではの特別な時間。 水の都の魅力を、ゴンドラの揺れに身を任せて堪能してください。,/images/tourist_spot/034.jpg
35,12,スカラ座,世界的に有名なオペラとバレエの公演が行われる、格式高い歌劇場。 ヴェルディ、プッチーニなど、数々の偉大な音楽家がここで名作を生み出しました。 豪華な内装と、世界最高峰の舞台芸術が織りなす空間は、訪れる価値があります。 劇場に隣接する博物館では、オペラの歴史や衣装、楽器などが展示されています。 イタリアの芸術文化、特にオペラの魂を感じられる聖地です。 華麗なミラノの夜を、一流のオペラ鑑賞で彩ってみませんか。,/images/tourist_spot/035.jpg
36,12,ドゥオーモ,"ミラノのシンボルであり、世界最大級のゴシック建築の壮麗な大聖堂。 約135本の尖塔と、約3,400体の彫刻が飾られた外観は息をのむ美しさです。 屋上に登れば、無数の尖塔を間近に見ながらミラノ市街を一望できます。 ステンドグラスが美しい堂内は、静かで厳かな空気に満ちています。 500年以上の歳月をかけて完成した、イタリア・ゴシックの傑作。 ファッションの都ミラノの中心で、その歴史と建築美に触れてください。",/images/tourist_spot/036.jpg
